<?xml version="1.0"?>
<guiao
	xmlns="http://www.pauloalmeida.org/guiao"
	xmlns:xsi="http://www.w3.org/2001/XMLSchema-instance"
	xsi:schemaLocation="http://www.pauloalmeida.org/guiao guiao.xsd">
	<cabecalho>
		<titulo>Título do Filme</titulo>
		<autores>
			<autor>Autor 1</autor>
			<autor>Autor 2</autor>		
		</autores>
		<data_publicacao><ano>2013</ano><mes>03</mes><dia>12</dia></data_publicacao>
		<personagens>
			<personagem id="p1">
				<nome>Personagem 1</nome>
				<descricao>Personagem 1. Declarada no cabeçalho.</descricao>
			</personagem>
			<personagem id="p2">
				<nome>Personagem 2</nome>
				<descricao>Personagem 2. Declarada no cabeçalho.</descricao>
			</personagem>
		</personagens>
		<sinopse>Sinopse do guião no cabeçalho.</sinopse>
	</cabecalho>
	<partes>
		<parte id="parte1">
			<titulo>Primeira Parte. Só com título e sinopse.</titulo>
			<sinopse>Sinopse da parte 1 do episódio 2 da temporada 2.</sinopse>
		</parte>
		<parte id="parte2">
			<titulo>Parte 2. Com cenas.</titulo>
			<personagens>
				<personagem id="p4">
					<nome>Personagem 4. Declarada na parte 2</nome>
					<descricao>Descrição do personagem 4</descricao>
				</personagem>
				<personagem id="p3">
					<nome>Personagem 3</nome>
					<descricao>Personagem 3. Declarada na parte 2.</descricao>
				</personagem>
			</personagens>
			<cenas>
				<cena contexto="Contexto da cena 1.">
				    <fala personagem="p1">Vou te matar!</fala>
				    Enquanto diz isto pega na <adereco>pistola</adereco> e dispara.
				    <fala personagem="p2">Ahh, mataste-me...</fala>
				    E cai morto no chão.
				    <fala personagem="p3">123</fala>
					<!-- GENE HACKMAN (V.O.) - The world of investing can be a jungle. (COMO REPRESENTAR UMA VOICE OVER? CONSIDERA-SE UMA FALA? 2 tipos de falas: locução ou diálogo?) -->
				</cena>
				<cena contexto = "Absolute bedlam. 300 drunken STOCKBROKERS, most in their early 20s">
				    <fala personagem="p1">Vou te matar, personagem 2!</fala>
				    Enquanto diz isto o <refere personagem="p1">personagem 1</refere> pega na <adereco>pistola</adereco> e dispara.
				    <fala personagem="p2">Ahh, mataste-me...</fala>
				    E o <refere personagem="p2">personagem 2</refere> cai morto no chão.
				</cena>							
			</cenas>
		</parte>
	</partes>


</guiao>